FMA00387.wav,"See, this is Sunny Jung. I'm a consultant to F D I C. I came to United States from China ten years ago and I studied in University of Maryland for four years and now I'm a programmer working on Oracle databases and"
FMA00454.wav,Hello my name is Lucy I work for a computer consulting company and I do software development work  and contracted International Aeronautics and Space administration that's all
FMA00458.wav,"My name is Shara. I'm from Mainland China. I have been here more than two years. I love America, especially in Portland. My husband and I, right now, my husband right now is studying in O H I C U, and I'm working..."
FMA00461.wav,"well what do you want to know about me? i think i finished, thanks for letting us, letting me contribute to this, donating my voice to your science project, very interesting"
FMA00463.wav,"Yeah, I'm registrant of the the Ohio State University. My first name is Z-H-O-U, Zhou, Last name is ji. My English name is Andy. I'm coming here for almost sixty years. And my major is in neuro science. Recently, I just do my research and also I prepare my."
FMA00467.wav,"My name is Jenny. I got my degree in computer science and I'm working as a software engineer. I like my job very much and I'm enjoying this new language project, and thank you for me."
FMA00469.wav,I'm a civil engineer. I'm going to school at the University of Illinois at Urbana Champaign. What basically we do is study structures build buildings and bridges and water treatment plants. General.
FMA00471.wav,"As I was speaking in Chinese, that we had an orientation for the new students who are coming into department and we are going to have a speech and I was going to, in the speech I was going to talk about the, two things. One is that they need to really use"
FMA00472.wav,"Well, I came from People's Republic of China several years ago to taking my graduate study in Economics. I got my Master degree in it and now working on my PhD and hope I can get it soon. After that I would like to do some research in economics and"
FMA00473.wav,"I'm a female, age twenty eight. Quite old. And I'm a student in EAP. I'm a second year student. Now I'm doing research on robotic speech recognition. My advisor is doctor."
FMA00476.wav,"This is Chong Sen Jen. And, I am very handsome people. Handsome man. But, talk you with me. That's okay. I have a black hair. And black eyes. And"
FMA00477.wav,"I'm from Shanghai China, and I got my PHD degree in the United States, now I'm working in United States."
FMA00478.wav,I'm a graduate student at the University of Michigan. This is my fourth year and I hope I can finish in two years. My major is in mechanical chemistry. I want to be a professor in the future. I
FMA00480.wav,"Brand new student, I'm study at the O H S U department of physiology. I'm glad to study here."
FMA00481.wav,I came to Portland last September for studying computer science
FMA00482.wav,"My name is Ching Tans, and I am a graduate student in University of Colorado at Boulder. I'm studying the mechanical engineering department. My research topic is subsonic bonding, which is part of the electronic package. This project..."
FMA00483.wav,"For me, I've been here for six months. I feel America is really a great country. I like many things here but still the pressure here is too much"
FMA00485.wav,"My name is hai. I have two best friends, their names are Carl and Dean. I play with them a lot. Even though they moved they come visit me every other weekend. I like to read a lot. My most favorite books, serious books, are the."
FMA00487.wav,Yes I came from Taiwan when I was about fourteen and when we first moved to America we stayed in Long Beach California we were there for a year and then we all moved up to Seattle it was when I was in college
FMA00489.wav,"Well I'm a student of portland state university, and my major is computer science"
FMA00490.wav,My name is George San I live in cider mill one two two four zero  northwest bounce road apartment three four five city of Portland Oregon nine seven two two nine
FMA00492.wav,"Anything. Well, yeah, I'm Tina Young. I live in New Jersey. I was a, an programmer.  I have a daughter and a husband."
FMA00494.wav,"My name is Jin Fong, I came from Peking China, I'm graduated from the medical school and have a md, after that I have experience for five years teaching in the medical school and have a finest"
FMA00495.wav,I'm from China. I came here almost a one years ago. Next month I will move to another lab in the U H S E U to do some
FMA00496.wav,Talk on the phone about this topic I like city of portland cuz I live here and the people of portland quite I think they are very polite and they are very friendly
FMA00498.wav,"Okay, my name is Ji, I'm from China. I have been about four years. I just moving from Tucson Arizona to Portland Oregon. The reason I come here is because my husband get a job, so"
FMA00501.wav,"Hello, I came here to study English, and without knowing what linguistics was about, eventually I got interested into linguistics so eventually I ended up studying linguistics and psycho linguistics in particular.  I am interested in a lot of different things, including..."
FMA00502.wav,"Hello. My name is Yung Chin Chu and I am studying in Portland State University and my major is computer science. I have only been here for half a year and finished two courses, two quarters and I'm so satisfied with my study here and the life"
FMA00505.wav,I'm just graduate student at Oregon. Oregon Graduate Institute and that's it.
FMA00508.wav,"I been here for, I mean the United States for eight months. And before then I was in Christ's College in Taiwan, and I worked there for two years. And most of the time I, I my work..."
FMA00510.wav,I'm currently a student enrolled in some graduate studies here at Taflaw
FMA00511.wav,I'm a student. I have to work. I have no interest in study
FMA00513.wav,"What do you want me to say okay, about myself? My name is Wendy, and I'm twenty-five years old. I like cooking, and I now study at P S U. And I like to play tennis, that I have, I"
FMA00514.wav,"I'm a student, I come here for studying but instead I don't study very much I just play."
FMA00515.wav,My name is An jin tin and I am from Taiwan.  I'm a graduate student at the University of Michigan and my major is physics.  Right now I'm doing experiments on lasers.  I think I like my...
FMA00519.wav,I am an immigrant here for about ten years and this is very beautiful city. I have been since I landed in USA in the
FMA00525.wav,My man is peter pan ping last name pang and I came from china and university science technology of china and I am graduate student at here in  university of california davis at department of applied science
FMA00528.wav,"I went in to Puka University in nineteen eighty-five. First when I enter Puka University my major is mathematics, a year after I transferred to department of chemistry and my major became."
FMA00530.wav,"My name is Katie Yee. I live in Silver, Iowa. Well now you know I'm working at a school."
FMA00532.wav,I came from China. My native language is Chinese. Before I came here I had worked for five years at the qing hua University as assistant professor in the field of nuclear engineering.
FMA00534.wav,"My English pretty bad so I rather speak in my own language Chinese. I came from China eight years ago and am a computer programmer and I live in Sacramento, California. And"
FMA00537.wav,"I work for an environmental consulting company and I came to the United States six years ago after I graduated from graduate school, I started to work for this company and I have already worked for the"
FMA00538.wav,"I was born in January nineteen, nineteen sixty-six. I came to America in nineteen ninety-four, and my major is Chemistry, right now I'm a graduate student at UC Davis and"
FMA00539.wav,My name is Tim Xie because Tim is my chi my English name and my last name is Xie it spells x-i-e. Let me tell you a very interesting story because x sound in hua is really very different for American native speaks to pronounce so one time when I.
FMA00541.wav,"Hi, sorry I guess my Chinese isn't as good as I thought. I couldn't answer all of the questions fully but sometimes the beep came before I could say anything so I don't know. I guess that I live in Rockville, Maryland. I went to Johns Hopkins University."
FMA00544.wav,I came from China were I get my bachelors degree there at Chin Wong university and then after work one year I come here to United States to be a graduate student. Why I come here well I want to get a degree phd degree from American
FMA00545.wav,"Myself what to say, I'm a graduate student in Economics here I came here two and a half years ago so far I like it I like this place I think there is more freedom and you can choose whatever you want to do and there is"
FMA00547.wav,"Hi. My name is Lial. I was born in Taiwan and I immigrate to United States nineteen eighty four. And I was very happy in this country. I had a very, I have a stable job. I have very happy family. My husband and"
FMA00551.wav,"Today I went to the library to study, and also I had a class there. We were watching the film Future, and we had a class discussion afterwards for about an hour. But later on, I have a lot of studying to do because I have a test on Tuesday. Tomorrow, hopefully the"
FMA00554.wav,Hi I'm coming from Taiwan it's nineteen eighty five then I went to rutgers University in the graduate school and got my master degree in electrical engineering department and after that I joined At and T
FMA00555.wav,Ok my English not so good but try to pride myself I am a student at U C L A and I'm studying atmospheric sciences which give you weather prediction maybe you can tv and can
FMA00556.wav,"I'm a architecture student, in the University of Minnesota. And, I, currently in the Master of Architecture program. I'm gonna graduate this summer. Yeah."
FMA00560.wav,I'm Grace Hong and I live in Taiwan for my entire life and I just moved to America for almost three years now and I don't have a citizenship yet and I'm married to an American boy actually he was born in Taiwan and moved to America
FMA00561.wav,"My family immigrated from Taiwan two years ago. The reason why we chose Portland, Oregon is that, is a pretty city, not too crowded, but still a very commune."
FMA00563.wav,"I am the students come from Taiwan. I came to UC Davis first time as a PhD program and my research is relate to the proteins, is related to enzyme. I am very enjoy"
FMA00564.wav,My name is John and I been in the US for ten years. I was born in Taiwan and I graduated from University of Washington last year and now I'm working as a civil
FMA00565.wav,I came to the United States four and a half years ago and I attended Washington State University to pursue it my PHD degree in mechanical engineering and I got my degree last October no October last August
FMA00566.wav,"Hi I was born in Taiwan, Teipei. I graduated from college in United States in Utah state. I met my husband at school and we both working in the Computer Science field and both programmers. We spend our"
FMA00568.wav,My name. I'm working as a computer consultant right now. My job is doing computer programming based on unix and the C plus plus languages. Currently the project is going well and
FMA00569.wav,"Oh well. There's nothing much to talk about anyway. I'm thirty four years old and I have a baby who is fifteen months. And I have one sister, one brother and that's about it. Anyway"
FMA00570.wav,This is sho pan ji from Oregon Health and Science University and currently I am a graduate student first year in the department physiology and pharmacology. I got this message from sherry love I hope that you could detect that.
FMA00571.wav,"My name is Ni ni Nguyen. I am ten years old. I like to play tennis and play piano. I also love playing tennis and, and roller blade. I have many friends and I want to draw and paint and do math at school."
FMA00573.wav,I am a just a very ordinary student from China. I used to be a physician. I have been here for almost three years. I have a daughter who is almost five years old. And my husband is a graduate student here. We were
FMA00575.wav,"Actually on, I used to be a student at Pallen State University and now I am working in the company as accountant. And I have been here for about six years and I really like northwest. I know"
FMA00576.wav,My name is Joying. I have been in America for four years. I'm an artist. I'm married. I have one
FMA00578.wav,"I'm a graduate student, I've been here for almost two years. As I said I just came back from New York and I had lots of fun. It's a pretty different country, different city I mean. I guess I just have twenty seconds."
FMA00580.wav,"I was a cardiologist working in Beijing, and I came here in the cardiology department, Washington University - Saint Louis doing research. I'm doing a study about coronary heart disease, which is related to working"
FMA00582.wav,"I'm a graduate student from North Carolina State University. I just graduated and obtained my master of science, in foot science, in January nineteen ninety-six. I'm looking for a job right now, all over United States. And it's been a drag, it has been three months beginning on January."
FMA00585.wav,"My name is Bennet. I have been in Seattle for about eleven years. I like playing basketball. I like watching basketball, some football."
FMA00586.wav,I was asked by I S I to make this call to one eight hundred seven three eight three eight one six to support the Oregon Graduate Institute research I don't speak very much Chinese.
FMA00588.wav,"Hey. I'm a Chinese student. I came from, the Northeast of China and I have been in the United States for seven months. I'm studying psychology. I'm a PhD student and right now, I'm working, I project about"
FMA00592.wav,"My name is Anna Chen. I'm attending Columbia University. It's a great school and I'm having a lot of fun. I'm making a lot of friends here but sometimes I get into relationship trouble. I wish I don't have those troubles then I'd be really, really happy here. I'm"
FMA00599.wav,I'm a student here and I think I'm too old to be a student. My daughter is here with me and she's a student too. So I don't know if I'm a normal student an an-normal student
FMA00602.wav,i'm a student a international student at reed college I came to the states last last year in august and I am studying computer science here i'm taking  mathematics and economics this semester and I like it.
FMA00603.wav,Well I am a Christian I was baptized probably when I was twenty years old. I went to a Catholic University in Taipei where I became a Christian. I was so.
FMA00606.wav,"I just came to the United States last September, in ninety-five. I chose chose simmons College for studies because it is all-women's college and single-sex education. For the classes, it's okay. But actually, it's not that good."
FMA00607.wav,"I'm a student at the American University. And, I heard about this survey through a friend, from the University of Colorado. And I thought it was a very interesting survey, and I  hope by my calling that I'm contributing to the research. So thank you very much."
FMA00611.wav,"I guess it will be the same story that I came to America when I was around twelve, grew up Monterrey Park. Had a lot of good friend over there. I haven't been to Taiwan for quite awhile. Growing up in L A seems to brought me up more toward American"
FMA00613.wav,"I, I'm a senior at Mount Holyoke College. I major in economics and computer science. I'm very confused. I'm graduating in two months, and I'm not sure if I should go to grad school, or I should go home. And I'm not sure if I should go to grad school here in the states, or if I should  go to England."
FMA00615.wav,I'm student of P S U my major is public administration and policy and I'm in the PHD program right now and this is my first year in Portland state university I think I enjoy my studies very much. I
FMA00619.wav,I come American was five years ago. I am an artist. I teach in children painting picture. I very like teach a children.
FMA00620.wav,My name is Gonsi. I come from China center. It is Siam in China. I'm the is a plastic surgeon. I work in the at the big hospital it's ten years. I come to America just eight months.
FMA00621.wav,"I'm from Beijing, I'll be here in Portland Oregon for about two years.  And now teaching Chinese in College, there are quite a few students taking Chinese now, I was happy to see that.  That there are more and more students here interesting in Chinese language."
FMA00622.wav,"I've been here for about one  year and a half.  I really like my job here, I'm teaching Chinese in  a small college and this year I have two classes, all my students are Americans and they really work their..."
FMA00625.wav,"Yeah, my name is Chen. I'm a civil engineer but I have a part time as a travel consultant so that's why I travel quite a lot. And almost all over the world and quite frequently."
FMA00629.wav,"My name is Terry. I am eight years old. I'm in third I'm in brightvale  and I'm in third grade. My parents... Three one one five southwest pearl avenue Three oh nine Portland, Oregon. Nine seventy one"
FMA00631.wav,I don't know what I should say about myself. I came to this country about ten years ago as a student. I finished my graduate study in Philadelphia and I moved to this Bay Area. Now I'm working about a company. I'm doing research work there. I like my
FMA00634.wav,"My name is Niet Hahn. I'm a graduate student at University of New Hampshire, Phd candidate.  I'm studying physics, space physics.  What else can I say?"
FMA00635.wav,ni gang sure shumma My name is julie and I am a senior student of the University of New Hampshire and my husband and I are.
FMA00636.wav,Hello my name is Lang Smith I live in Portland Oregon I've been here already six years I love this city very much I love to here the beautiful view and the mountain and the river I like to go outside every weekend and see
FMA00637.wav,I'm a graduate student in University of New Hampshire. I came here in August of nineteen ninety-four. This is my sixteenth year. I thought here it's a very. People here are
FMA00639.wav,"I'm born in Taiwan, and was a subject of Japanese empire, in nineteen thirty-eight. And I study Japanese language until nineteen forty-five. At that time the United Nations defeated Japanese imperialism, and I start to study Chinese Mand"
FMA00640.wav,"Right now I'm a student and I'm calling from my office on campus, today the weather is really nice but I didn't have time to go"
FMA00641.wav,My name is Jin Jia. I'm a Chinese girl. I have been here one year. I am twelve years old and I like to play piano
FMA00642.wav,"My name is Jane Linh Hung, I came from Taiwan, have been in United States for about thirty years, and I really like this country, I am a citizen now and I"
FMA00646.wav,I'm a grad student in the University of New Hampshire. I got this message from a friend and who got that from the I.S.I. he are recognizing. She told me the I.S.I. is a organization that have Chinese students.
FMA00648.wav,I come from Taiwan and I started at University of Colorado at Boulder. And I majored in environmental engineering. And I will do something in waste management. And I plan to get a phD degree.
FMA00650.wav,"I'm a graduate student at Seattle University of Washington here and I have been in Seattle for almost two years and its its it's okay so far, and I think I like Seattle so far, I haven't met met many friends here."
FMA00651.wav,"About myself, i'm now a graduate student in u w physics department, and i'm entering the research area named space physics, and i'm  learning mathematics"
FMA00654.wav,"My English is not very good so. I'm a graduate student here in Pittsburgh for PhD program. You know a PhD program take a long time to finish it, to complete."
FMA00655.wav,I'm a greater student in the like linguistics department
FMA00658.wav,My name is Jiang Li. I'm twenty seven years old and I'm studying in University of Oregon in East Asian study department. Right now I'm doing my thesis for my masters degree. I think maybe five years ago well a family member moved to Canada. Right now a family living in Canada
FMA00659.wav,"My name is Jenny, and I graduated from University of Minnesota. I came to the United States I think about three and a half years ago, let's see nineteen ninety nine. Oh no nineteen ninety two. And then I get a Master degree from SUNY but some of the information."
FMA00660.wav,I am a first year PhD student from at O G I department computer science and I came from Beijing about six months ago.
FMA00663.wav,"Well I don't know what should I say, I, its pretty fine outside and I just want to go out and get tan a little bit and I just want to enjoy the sunshine and read some books."
FMA00664.wav,I come from Taiwan. I'm now attending the University of Colorado at Boulder. I study telecommunications which is a masters program. I hope I can graduate in two years and that's about what I'm doing now.
FMA00666.wav,"Okay i'm a student in portland community college, now i am studying writing class and computer class, that computer class is about unix it's very difficult and very new for me"
FMA00667.wav,My name is Peter Chan. I just graduated from Florida Institute of Technology in nineteen ninety-one. And came here in nineteen ninety-eight  . I moved to Oregon in nineteen ninety-five.
FMA00669.wav,I'm a Chinese girl I came from China about six months
FMA00674.wav,"I'm a graduate student in UC Davis. I am a Chinese from mainland. Yeah. I, although I have learned English for over ten years, I still can't speak English fluently. After"
FMA00676.wav,"Hi, my name is Sandy. I'm a twenty-one year old female and a student at Berkley. I go to University of California, Berkeley. I live in Berkley, and I like to go hiking. I like to do email. I'm on the Internet very often. I have a lot of friends that I appreciate, and sometimes we go singing or"
FMA00678.wav,"I like to dance and I also like to play, oh I like to play computer games. I've been dancing, I danced before around eight years old and belly and I came to University of Oregon. I try"
FMA00679.wav,"I am just from China and three years ago I graduated. I graduated from Nankai University and my major is chemistry. After my graduation, I wanted to research in spatial."
FMA00680.wav,Well my name is patricia lee and I came from Taiwan and have been here for about eleven years and I just graduated last year and now I'm working so
FMA00681.wav,"My name is Chiunta Chen the spelling is C H I U N T A my last name is Chen C H E N my address is forty-four hundred Park court, I live in Urbandale Iowa the zip code is five."
FMA00682.wav,"Well I'm a Software Engineer and I live in California. I work for a company do the simulation and that's it, I guess. Everything's here is fine for me."
FMA00685.wav,Right now I'm a graduate student of O G I the department of chemistry biochemistry and the molecular biology and the major program I studied is molecular biology I do not have this background before I have the chemistry background so it's a little tough for me
FMA00687.wav,Hello. My name is Bonnie Kell and I'm being asked to record this message. I am twenty eight years of age and also being recently married. I'm not sure what else I have to say but I grew up in Taipei Taiwan and came to the US about ten years ago.
FMA00689.wav,"Hi my name is Emily Chow, living in San Jose and I've been here, I mean have been in the States for three years. I'm really interesting this project I hope I get to name my time to help you, I believe that the world be better."
FMA00691.wav,My name is Mary Lee. I work for Sony Electronics. I'm a computer engineer. I have been here sixteen years. I speak Mandarin fluently and speak Cantonese and Taiwanese. Originally I'm from Taiwan and
FMA00692.wav,My name is Lai mei fong and I come from Taiwan. And I came here because I want to study more about teaching in English.
FMA00693.wav,I am a tenant I like to play with computers well I guess not to play and just use computers and surfing on the internet and stuff like that it's really
FMA00696.wav,"Hello. I go to school at the University at Albany. And it's been a while since I've really spoken fluently in Chinese, that's why I'm a little rusty. But, I pretty much understand Chinese, and I write, I read, write and..."
FMA00697.wav,Hi everybody my name is Elaine and I currently live in los angeles california I'm graduating from u s c political science major and as you probably can tell my english is better than my chinese even though chinese was my original language
FMA00698.wav,"Well, I was originally born in Taiwan. And my family, we immigrated to North America when I was around eleven, ten years old. I went to high school, and then came to Cal. It was very neat experience. It's kind of interesting to see a lot of Chinese people at the campus."
FMA00700.wav,"I'm twenty two years old. I'm twenty two years old. I'm Asian male. five feet eleven, a hundred sixty pounds. Do I sound sexy? I don't know. You can tell. And I'm currently to go a college and by the way, you."
FMA00702.wav,"I am working for a computer company right now. I am purchasing, purchase all the computer components and some of the stuff for the company. And we have in fact twenty cells in the company and I take care of every purchasing, everything."
FMA00705.wav,"My name is Ken. I live in Portland, Oregon. I am twenty five years old and I graduated from Oregon State with a degree, with a BS in marine biology. I had a really good time going to Oregon State because that's when I met my lord Jesus Christ. And it was a lot of fun. I went, lived"
