FMA00009.wav,"Well I'm a student in, at the University of Illinois at Urbana-Champaign and I'm in computer science. I'm graduating this month and I hope I can apply in America but I'm operating in China. That would be good for me."
FMA00012.wav,"Hi, how's it going? I just translated what I said in Chinese. I'm a grad student here in the University of Nebraska-Lincoln and I'm graduating very soon at the end of this year and I'm leaving very soon and I'm going to do my PhD somewhere else. Lincoln is a very nice."
FMA00015.wav,I am a student in Arizona State University. I've just come from China four months ago and my major is physics. I find physics is very interesting and it's also very demanding. It require you very good mathematics and.
FMA00017.wav,I'm a girl from Hong Kong I came here twelve years ago.
FMA00020.wav,"It's a question about me.  I think it's worth not to say anything, because I think that I am old, and I'm not so well.  I just want to go to church."
FMA00022.wav,I study in the united states I mean I study in the university of Missouri as MBA I am freshman and I study computer science and am pursuing an AB degree its finally coming
FMA00024.wav,"Okay. My name is Di Yuo. I come from China and I'm an undergraduate student here at the University of Georgia. And I just, when I go through the computer, internet network I have to found this, I have to find this information."
FMA00027.wav,"Well, I'm not really sure what to talk about. I guess I can just repeat what I said before. I'm like a student here at the University of Texas and waiting, studying to take a final exam in a few hours but decide to take a break and call this phone number."
FMA00032.wav,"My name is Daniel She, I'm away from home, my home is in California, San Francisco Bay area. And I'm here in the east coast in college and I enjoy the life here, I'm sure because it's so different from California"
FMA00033.wav,"My name in young hong Yen.  I came to O G I for my PhD study.  I used to be in speech research, and now I am still working on speech recognition speech recognition and language identification.  That's pretty much all the information about myself."
FMA00040.wav,"My name is Yung Hun. I came to United States in last year last year. Now I work in Burger King for, as a part time job.  I want to go to"
FMA00041.wav,"Hello, my name is hui su. I was, I was born in northeast of China. I came to American about two and a half years ago. My major is material science."
FMA00043.wav,"Okay my name is Wan Chung now I'm in O G I the department of chemistry, molecular biology and yeah the department of chemistry, biochemistry and molecular biology"
FMA00046.wav,I'm a student coming from Chani I am studying mathematics.  Now I am pursuing my PhD degree at the mathematics department at Arizona State University and my major field is non identical systems and bifurcations.  And now I...
FMA00050.wav,"Okay. Let me try. And I grade at in Shanghai now, in Shanghai Medical University with PhD degree and come here with, as a post doctor, Dr. Ying"
FMA00054.wav,"Fun huh, nothing to say."
FMA00055.wav,Ok I was born in and grew up in tai tin Taiwan in nineteen sixty-seven and I finished all my high school education and university education in Taiwan came to the states in ninety two to study at the university of michigan my major is electric engineering I am not a PHD student
FMA00059.wav,"My name is Xi Yang, but you can call me Alan, my English name. I graduate from University of Science and Technology, Beijing, and get my master's degree there. I take tough call in January, nineteen."
FMA00060.wav,I came to the states in nineteen eighty-five I started a New York University. got my PhD physics now im in post doc and research fellow at marcus university in department of biochemical engineering i prefer to stay here
FMA00062.wav,Well my name is Jin Long I'm a student in North State University I have been here for five years now I'm study in education and administration and foundation hopefully I will graduate
FMA00063.wav,"i'm graduate student at new orleans graduate institute, before i came here i was in canada i worked for some time, and i was a mechanical research engineer in china and i worked for many years there."
FMA00065.wav,"Well like I said, I came to the U.S. seven years ago. I graduated from college in China. Went to Peking University and graduated in nineteen eighty-six and came to the U.S. in eighty-seven. I got my masters degree from Rutgers University in New Jersey and"
FMA00068.wav,"Oh hi.  I'm glad to to to speak to to speak Mandarin you know to to have some recording.  I like I love to do this type of job. And I love to help, to help people."
FMA00069.wav,"I'm a Chinese, I have been here for four years. I would be glad to do anything for your research, so if you have any question, you can give me a call at the number I mentioned before."
FMA00070.wav,My name is Jeloo I came to the United States for four years already I really like here and right now I'm a student and also work for U S D A department research laboratory hopefully I
FMA00071.wav,Hi my name is roo wong im twenty nine years old I working in community research lab in mastro state university my job is commuting with research specialties and we have a project that is
FMA00072.wav,"Hi my name is Mung Pei Wah and I came to the United States about five to six years ago, and I first went to Indiana University in a graduate degree and now I'm working for a computer company in California and."
FMA00089.wav,"I came to the United States in nineteen eighty three and I was an exchange scholar. My studied field was in law. I spent one year at New York University, two years in law school"
FMA00090.wav,Hello everyone. I starting in University of Oregon. My major is chemistry. Right now I am getting a lab to do undergraduate research and about crystallography. I am very excited.
FMA00092.wav,"I'm twenty-six years old and now I with I'm with my husband study in University and his major is government science, I'm planning to enter the telecommunication major and I hope I can enjoy"
FMA00093.wav,"My name is Lin Chu Yen, my age is thirty years, thirty years old. I was born in nineteen fifty-five, I'm a male."
FMA00094.wav,Okay I think this is better my name is Mi Jong and I am twenty one years old I have been attending University of Oregon for three years this is my junior year of course and I been studying psychology
FMA00097.wav,Well my name is hong wei tan I come from Taiwan and I like music mountain climbing hiking and I also like reading yeah because knowledge to me
FMA00098.wav,I'm a reporter for a daily chinese news paper called the world journal. I also sell real estate as a realtor. I forgot to tell you my telephone number in the previous question. My number is five oh three six three five
FMA00099.wav,"I've been here for almost three years and I appreciate my parents giving me this chance to come here and normally I'd like to see, when I was in Seattle I"
FMA00101.wav,"My name is Charlene Hwang. I came to Eugene, nineteen ninety-two, four. I went to school here. And my major is marketing and finance, and now I'm taking minor in computer science. I like the class pretty good. It's kind of fun. And..."
FMA00106.wav,"I'll just continue what I just  was talking in Mandarin, which was, I moved to Houston and I've worked here for about six to eight months already, and Houston's weather is   also pretty hot and muggy most of the time but it's okay since most of the time"
FMA00109.wav,I was born back in Taiwan and I came to America when I was eleven. America's basically a wonderland for me since the schools are so easy and there's no punishment from the teachers to students like back in Taiwan.
FMA00110.wav,I was in Canada for five years before I came to the United States. I got a PhD degree in electrical engineering. Now I'm working in software company and my job is designing software for printed circuit board.
FMA00112.wav,I'm a graduate student in the field of biochemistry I came from Beijing China and I graduated in nineteen ninety from Beijing University now I'm doing my research for a PHD
FMA00114.wav,"I am a graduate student at New York University Medical Center and I will be finish my PhD thesis in next few year, next few months I guess. Maybe I can a PhD in next like two months or something. I guess I can"
FMA00115.wav,"My name is Charles Chang, I am a freshman at the University of Pennsylvania in the Ivy league. I grew up in Texas, but I was born in Boston. I spent the last six years of my life in Taipei, attending Taipei American school. I tend to be a little bit arrogant. Very self confident."
FMA00117.wav,"Hi my name is Jeannie and I've been living in the States for five years and I really like my place and my room mates are great, they are talking to me right now and they're watching White Single Female and we're having a good time."
FMA00120.wav,"I'm a graduate student at university of washington here in Seattle. This is my first year, I'm currently studying very hard I'm earning my PHD in education So far im enjoying it I'm twenty seven years old female second child my family lives in."
FMA00124.wav,"and I'm graduate student at Ohio University and it's expected to graduate next June. And I hope I'm going to graduate I can find a teaching job, a teaching position in the USA and besides that I hope to"
FMA00127.wav,"My name is Virginia I come here United States in nineteen ninety-two. I've been working in the computer field, I'm senior program analyst and six years ago i retired stay home and take care of my baby and my older mother, she's in eighties and that time my daddy was"
FMA00130.wav,Hi. My name is Shin Chang Leong. Some people also call me Kevin and currently I live in Chicago and I work as a software engineer. I like my job basically and it's a lot of fun.
FMA00131.wav,"I am working on a PhD French literature and I am going to have my degree in May and after that I will be teaching in the university and I, that's about all. What else can I say."
FMA00143.wav,Hi. My name is David and this is rather hasty I don't know what to say right now but if I know anything it's pretty much the same as I have already told you. About my dreams and my ambitions. I'm really sick and tired of the Army and they don't treat you
FMA00144.wav,I come from Malaysia and now is twenty-one years old. My major is electronic media TV productions. I just did a year is because I feel this is challenging and my country needs this kind of professional. Furthermore I
FMA00152.wav,I came here nearly two years ago. I complete my undergraduate study nearly ten years ago and worked ten years and then I came here to study
FMA00154.wav,I'm doctor Steven Bahir and I'm doing some research and also I bring some teaching job and I am teaching professional management course before I came here I was an
FMA00155.wav,I came from the mainland of China and I am thirty-two years old and about one meter and sixty-eight height. And I work in the Mississippi lab and my major is chemistry. My
FMA00161.wav,I'm a graduate student at the Biophysics Program in the I U medical Center this is my first year in the this program my my project is to study the structure of a protein which is very important in the alcohol metabolism
FMA00164.wav,"Okay, my name's Yo Min Hee in English but Hu Yu Min in Chinese so I just came here last year in August and I was a first year graduate student in UC Berkeley and I of course I I live in Berkeley and my husband"
FMA00166.wav,"Hello, my name is William Jones, I came from Beijing China in nineteen eighty-eight. In China I was a TV editor in China central."
FMA00173.wav,"I born in China and was educated in Wuhan. I got my undergraduate degree in the management science. After that I had, had to work for government about five years before I came in to the states. I graduate"
FMA00174.wav,"I came to the United States fifteen years ago, now I am working at a computer center of Christopher Newport University, and I enjoy my working, and"
FMA00175.wav,That's very easy or very tough. Right now I'm a graduate student and am very busy in the lab working on my thesis so I'm sort of very concentrated but besides that I think I'm a.
FMA00176.wav,"Okay. I'm a student, a graduate student in University of Colorado, Boulder. Well, in spare time I like to listen to music, like body building. I like swimming and of course I'm a CS, I'm a computer science student so"
FMA00179.wav,"my name is michelle wu, I was born in a small city in china, i came to the united states about five years ago, and I studied physics as a graduate student, i'm getting my phd in a few weeks."
FMA00180.wav,Hi. This is Jack Linning Yung. I just graduated from the University of Texas at Austin. Computer science department as a master degree and I studying working for a National Instruments from
FMA00181.wav,My name is Chau Fu Lord and I come from Main Land China I was a graduate student at Cal Tech right now.  And I think I'm going to graduate pretty soon and hopefully I join I get a job and do
FMA00183.wav,"Hi, my name is Ma and I'm calling from Clarkson University."
FMA00184.wav,"I came from the University of Science and Technology of China, and right now, studying as a master student in Biomedical Engineering Center at Ohio State University. And now I'm doing my thesis at California Clinic Foundation I'm supposed to graduate this summer."
FMA00185.wav,"My name is Shan du. Shan du Me. I'm working in the web station in University of California. I've been in this country for twenty no, no, no twenty. twelve years. I think I like this country very much but."
FMA00186.wav,"Well I am a graduate student in the neurology department of Penn State University. I'm studying anastro chemistry. I'm trying to relate to use lasered use force to measure the trace gas nano and nano two in an atmosphere. and have lots of hobbies, I'm not really good at any of them."
FMA00187.wav,"Well hello my name is Dashing Tai I came from the People's Republic of China in nineteen eighty-nine right now I'm a graduate student in the vision science program in the University of California at Berkeley, I'm"
FMA00188.wav,"My name is Yung Hui. I'm thirty years old. I'm, I think that's it. Yeah. I'm graduate students at Columbia University."
FMA00189.wav,"I already told about myself before. My name is Sue and I graduated UC Davis and in the first year, I have a baby, Jenny. She stay with me and  mom. And mom takes care of her now, but she's going back to China. I'm going to."
FMA00192.wav,"Okay, I'm a graduate student at U C L A and I have been here for like two years. And my major is physiological science. And I'm pretty enjoying the life, the life in L A. I like the city."
FMA00194.wav,"My name is Salu Tran, I come here to study for my PhD degree. I spend, I have spend about six years here. And, something like that."
FMA00195.wav,Hi I am in love with you or you can call me Linda my my my dad is is Lung Lang Troo my mum Ying Yang I'm eight years old My birthday's in November.
FMA00196.wav,Okay I'm a graduate student at Columbia University and I'm basically at my fifth year and trying to finish up the graduate school and probably I'll find a post op position and after to look for a job academics is my favorite of all but if I can't find anything I have to go
FMA00197.wav,I came here three years ago and I'm now studying in statistics I'm a PHD student in the studies state department in up doing worse here and right now I be working on my thesis hopefully
FMA00198.wav,"Oh well you know I'm a grad student in Columbia, so I worked really hard, just want to get my PHD as soon as possible, and next to that I'm working in pea pyoretics night."
FMA00201.wav,"I'm a graduate student and my major is medicinal chemistry, but I will transfer to biological graduate, biological science graduate program in this coming fall semester. I want to be a research in the company in the future. And I'm twenty-four years old..."
FMA00203.wav,"Hi My name is Zong xiang and I came from United, I came from China and have been United States for two years and I just graduated from rutgers University with a masters degree in chemistry, and I'm looking for a job right now."
FMA00204.wav,Well I am just a graduate student studying psychology at university of chicago so I come from China and I'm reasonably young among the graduate students I work hard I started
FMA00206.wav,"I don't speak good English, well anyway been here about five years."
FMA00209.wav,"I was from China and I'm studying University of Washington, my major is biochemistry and I'm junior now. I always go to summer school. I have a part time job in a pathology department."
FMA00210.wav,Well what can I say about myself? I just say I'm a wonderful person and I got a medical right here and I was educated in China. Since I came here I've been working hard because that's about it. If I have time I like to play outside I like to.
FMA00215.wav,"Hi, I'm a physics graduate student in physics department of Syracuse University. I am working on particle physics, it is a very exciting field, with a lot of new phenomena, and with"
FMA00219.wav,My major was bio statistics.  I studied my degree in the University of Massachusetts.
FMA00221.wav,"I came to the United States five years ago.  And before that I was a student in Taiwan and finished my bachelor degree and then I came to UC Berkeley to study Electrical Engineering, and this is my fifth year, and I'm about to graduate, and I probably will look for a job either here..."
FMA00222.wav,I don't know what to say. I'm a graduate student here stayed in the states for about five years now and not much special things I guess. Everybody is leading quite a hard life here.
FMA00227.wav,"Hi my name is Annie Kawl and I come from I come from Taiwan and I have lived in Kansas before, now, after four years, I moved to California I get used to California's weather I think.  The weather here is very nice.  I like to swim."
FMA00228.wav,"Hi my name is Jian, you can call me Jay. I have an English name is Jay. I have just been to Atlanta for one less than one month. Before that I spent nine months in Massachusetts. I was a graduate student at University of Massachusetts Amherst."
FMA00232.wav,"Hi, my name is Barbie Chen, I'm twenty six years old and I was born in Taiwan, and I came here when I was fourteen years old, back in nineteen eighty-three, and I've been here ever since. I lived in Palos Verdes for nine years and."
FMA00234.wav,I am a student. I just graduated from high school in Canada.  I'm around eighteen years old.
FMA00247.wav,Well I'm a student and that's about it. Can't give you anything more personal than that.
FMA00258.wav,"I was born in Taipei, Taiwan in nineteen sixty-eight."
FMA00266.wav,"Hi. I am new student, a PhD student in the Jia jia Institute of Technology. I come, I have a last year for a week. I feel a little homesick but"
FMA00277.wav,Well and I've been in this small city about over thirty years and I been practicing my profession and have just recently retired and have a lot of hobbies
FMA00279.wav,When I first came here I lived in New York City and it's really different from where I am now the college campus it's a lot more noisy and dirty and crime but it has its better points like shopping.
FMA00281.wav,"I'm trying to learn Japanese right now and, because my, I mean my current girlfriend is Japanese, and I'm also very interested in Japanese culture so this when I'm learning yakana and I find it's really difficult, and although as a Chinese I took advantages of learning how to write"
FMA00286.wav,"Hi. I'm a research scientist in the hospital in New Jersey and my main, I'm mostly I'm working on the medical biology project concerning the human genetics and cut some kind of"
FMA00287.wav,"i came to united states last august, and it is my first time here, and i really enjoy the small town here, because that I think that this is a nice little town, and people are nice friendly and i enjoy life here."
FMA00288.wav,"Well I came to the United States about seven years ago. Came here for college. And I was happy that I did that. And I know a lot of friends, and get to know a lot of wonderful people. The weather in the city that I study in was a lot nicer than..."
FMA00291.wav,My name my names heathu I'm graduate student  of laleigh university my major is accounting I take two courses this semester one is one is accounting another is endiro
FMA00292.wav,Hello my name is Meg Caine and I am a freshman at U T Austin my address is eight o one west twenty fourth street number one twenty two austin texas seven eight seven o five currently I'm just working
FMA00293.wav,"I am a, I am a new student of Long Island University-Brooklyn campus. I am a graduate student. My major is Accounting. I took two courses this semester. One is Finance Accounting. Another is In-"
FMA00296.wav,Well I have been into the United
FMA00304.wav,"I am a research assistant at a medical school. I just graduated from college. Actually, doing some computer work right now and I'm talking to my phone."
FMA00309.wav,My names roger I graduate oh no I dont graduate anyway study in department of horticulture at oregon state university I like sport I like playing the game and I like swimming and I also like collect stamps
FMA00314.wav,"My name is Tsing-Tsing Yuan, I'm visiting scholar from Tsuru University I work there about twelve years in the P E department, teach human anatomy and bimechanics and sport and statistic massage and I do very good job"
FMA00317.wav,I'm a visiting scholar from in Oregon State University. I'm from China. I'm accountant at statistics in Beijing Agriculture College. Now I
FMA00318.wav,"My name is Way Ding, I come from Beijing China. I just got my master degree in nutrition and food management and I'm looking for a job right now, I hope that you got one but I don't know. OK that"
FMA00319.wav,"I'm a lady named Carla from China. I work the in Beijing Agriculture College. I'm a teacher and I, after here I"
FMA00326.wav,"hello this is my english name, my english name is valen, why i coat this my name, because my birthday is february fourteenth, so this is valentines day so i name my"
FMA00329.wav,"Hi. My name's Vivinia. I living here for about six years. Right now I'm working at Renaissance In Car Services. And it's a very good job, people are nice to me. And I like it very much. And that's where I found out this information about Oregon."
FMA00334.wav,"My name is Frank Chow, and I am right now working for Bull & Babbich corporation. My title here is technical analyst. And, I enjoy my work here, and in this way I have cha"
FMA00340.wav,Most recently me and my wife have are expecting a baby and the child to arrive sometime in January probably late January. We are both very very excited about that and we are getting ready for it. We know it's going to be a girl and we already gave her a name
FMA00342.wav,"And now, I'm an international student in Florida International University.   I am a PhD student here, majoring in mechanical engineering.  And, I want to spend four years to get a PhD degree, then I plan to go home, go to ...."
FMA00345.wav,"I'm a PhD student in the University of Maryland. I came here in nineteen ninety-four. And I transferred here in this summer. My first school in the United States is in the University of Tennessee, in last year. Or..."
FMA00355.wav,"Hi, I'm Mack and I'm really interested to know about, more about the programs at different university. And I'm interested because I always like to have a chance to speak Mandarin. So I'm trying to enroll in a few courses and hope that I will learn more about"
FMA00358.wav,"This is Joyce Ching. I'm from Taipei, Taiwan. I'm a graduate student in U N L. My major field is MBA in chemistry and international business. I'm located in New Orleans, Louisiana."
FMA00359.wav,"Hi, my name is Philip, age twenty five, studying at the University of New Orleans MBA program. And right now I live Metairie is somewhere near downtown New Orleans and this city is pretty good. And probably after MBA finish after graduation MBA that's maybe a year ahead and I plan to go."
FMA00376.wav,"I'm meteorologist, I'm doing a lot of books, atmospheric research. My research is mostly conducted on computer, I'm doing computer"
FMA00377.wav,"My name is Chang Yu and I am a research scientist right now at the University of Colorado, I am doing  satellite  meteorology.  Basically my work is research for climate, that's all."
FMA00378.wav,"Hi, I am a graduate student at the University of Colorado. I'm studying computer science and this is my first year and I am expecting to graduate in another year."
FMA00379.wav,I come from mainland China and I'm working for I B M at Boulder right now and my husband he study at C U Boulder and we're happy living together
FMA00380.wav,Well I'm a bible student in Wanoma back at school and I've been here for one half years and I really enjoy studying here and it it's a great experience of studying here and I love my my roommate
FMA00381.wav,"My name is Zeng. I work for software company located in Denver, Colorado. I came here from China in August nineteen-ninety. So I have been here for five, for a little more than five and a half years now. I like it here"
FMA00382.wav,"My name is Wendy Xi. I just graduated from University of Colorado in environmental junior major. Right now I am working in a law firm doing some consulting work. I'm really enjoy my work. Actually I have a client, there are..."
FMA00383.wav,I'm responsible sensitive
FMA00385.wav,"I am from China, Hong Kong. I got my PhD degree and two year post doctor work in a major university. Then now I feel pretty happy and I make a lot of programs for my research recently."
