FMA00707.wav,I am a graduate student in University of New Orleans. I'm studying in business. I'm an MBA graduate student and I like swimming and I'm trying to learn skiing and scuba diving this summer. I love all kinds of animals and I'm going to be a
FMA00710.wav,"Hi. I come from Taiwan. I have been here six, nine months. I really like Eugene. This city is pretty good for studying."
FMA00711.wav,"I come from Malaysia and right now I'm studying in University of Colorado Boulder as a masters student in economics, will I like to study in Environmental its pretty friendly and competitive."
FMA00714.wav,"I'm a student and I'm a student and came from China several years ago to study scientists here and I'm going to, right now I'm doing my thesis on anti H I V ribosome and ribo"
FMA00718.wav,"Thirty years old young man from Taiwan and currently I live in Eugene, Oregon and I'm a student at the University of Oregon, studying to become a Bachelor of Fine Arts major. And I have a lot of friends here but I try not to hang around with people too much so I can concentrate on my studies."
FMA00721.wav,Hello. My name is Rose and I am trying to do this to help out for my husband neice and this is interesting. I have
FMA00724.wav,I'm a student
FMA00726.wav,"My name is Grace lee. I came to this country about ten years ago, nineteen eighty five. I came here as a graduate student study at Chicago. After I graduate I join I B M working as a computer programmer"
FMA00727.wav,"Okay I'm going to tell the same story which I just told you in Chinese, where I came to the United States about twelve years ago, where I travelled and stayed in different cities, among them Chicago is the primary place that I landed on and where stayed for about four years or so, where I started my degree and worked part time and full time."
FMA00729.wav,"I'm from Taiwan, I have been here for thirteen years,  I work as a programmer, I'm single and so far I enjoy this country, it offers a lot of opportunities."
FMA00732.wav,Well I have been integrated to the United States ever since nineteen ninety-seven I completed middle school in Taiwan attended high school in Madison Wisconsin and attended University of California Berkeley in United States I
FMA00733.wav,oh this is really interesting oh my god really can of disrupting to speak me to entering into English. occasionally I taste. I'm taking some I have finals tomorrow and I'm really bored to death right now actually I shouldn't be bored because i have a butt load of work to do but
FMA00737.wav,"i'm a student of clinical medical science, i was a , i was a doctor in china, i studied chinese medicine before, when i come here, i decide to listen"
FMA00740.wav,Yes I'm a mechanical engineer I working for Wise tech knowledge here it's a very nice company I like here the manager is a very nice man I like him and everyday morning I come here at eight o'clock and
FMA00741.wav,OK. My name is Shen and I live here in Honolulu. I'm Chinese. I have black hair and black eyes. I like to watch TV and go on the internet. I like to read too. I speak English.
FMA00743.wav,I was born in Taiwan and I come to the U.S. when I was eighteen years old and I went to college and graduate school here. I started working right now in a computer company and I like classical music a lot and I spend most of my time doing reading and listening to music. That's it. I'm twenty four years old
FMA00745.wav,"I'm lucky because I live with my mom and she take care, she take care of my two kids and well, overall, I think I'm a lucky woman because everything for me is so great. I have no complaints, everything is fine, that's it."
FMA00747.wav,"Hi my name is   Hishal. I'm a Phd student at the Department of Microbiology at Case Western Reserve University. I'll be graduating in a month. And after I graduate, I will probably go to a lab to do the post-doc work"
FMA00748.wav,"My name is Judy Du. I'm a student at University of Texas at Austin. I'm, I'm, a student major in special education. And right now is an end of semester section. I'm prepare my fin..."
FMA00749.wav,"My name is Cheng Ting. I came from Guangdong three months ago and we will live there for another, maybe another half a year or Hingsualah."
FMA00755.wav,"Hey I'm a graduate student studying  at Harvard university. I am studying for a PhD degree in Chemistry. I'm going to graduate very soon. Afterwards, I'm going to do post-doc at California. I'm looking forward to going to California because at Boston it's really cold in the winter and winter is very long. I really really"
FMA00769.wav,I was born in Taiwan and I came over here when I was twelve. Went to Texas and lived in Houston for a year. And then came to Santa Monica and lived here ever since. Went to Junior High and High School there. Went to college at U S C and now I'm working in West L A and
FMA00770.wav,Now I am a graduate student at Temple University since nineteen ninety-three.  I studied at Temple University in Electrical Engineering department.  At there I studied lot of coffees...
FMA00771.wav,I'm a graduate student in Utah State University studying for the statistics. That's the Bachelor degree for me and I will graduate next year.
FMA00788.wav,"Hi my name is Sen Kai, and now I'm living in Addison in New Jersey, I have been here two years from China, I'm working University of Danchester and Madison of New Jersey and"
FMA00792.wav,"I am a graduate student at here in the University of Iowa. I go to internet often. Now I visit around my friends home page. I find, I can call this number to speak, chat"
FMA00794.wav,"My, I myself is a grad student here in the Iowa University. I know it's, the card name is the University of Iowa and I'm currently studying Chemistry here. I've been here for one year and I think the great advantage"
